{
  "schema_version": 3,
  "call_id": "prefix-0",
  "phase": "prefix",
  "history_index": 0,
  "prefix_sample": 0,
  "branch_index": null,
  "adapter_sha256": "aaaaaaaaaaaaaaaaaaaaaaaaaaaaaaaaaaaaaaaaaaaaaaaaaaaaaaaaaaaaaaaa",
  "raw_advantage": 0.25,
  "branch_factor": 1,
  "inclusion_probability": 1,
  "global_groups": 1,
  "G": 2,
  "K": 2,
  "fixed_scale": 256,
  "group_denominator": 2,
  "call_logprob_sum": -1.5
}
